video_id,chunk_number,Processed_Text_chunk
YBF9c2mCGME,1,"Are you struggling to pass the CompTIA Security Plus exam? Or maybe you just want to test your knowledge before the big day. Well, you are in the right place. Today, we are diving into 50 must know Security Plus practice questions with full explanation to help you crush the exam on your first try. Whether you are prepping for the test or just sharpening your skills, these questions will challenge you and reinforce what really matters. Stick around till the end because I will explain not just the answers but why they are correct. And if you are serious about passing, I also have a free full Compia Security Plus course right here on this channel. Check the description for the link. All right, let's jump in. Your Security Plus success starts now. Question number one. To enhance the security of their virtualized environment and prevent VM escape attacks, an organization is implementing several security measures. Which of the following actions should be included in their security strategy? Select two options and the options are option A enforcing resource allocation limits for virtual machines. Option B, regularly patching the hypervisor and virtualization software. Option C, disabling unused virtual network adapters. And option D, implementing a zero trust security model. And the correct options are option B regularly patching the hypervisor and virtualization software and option C disabling unused virtual network adapters. And the explanation is so to defend against VM escape attacks where a malicious virtual machine breaks out of its sandbox to interact with the host or other VMs organization should number one regularly patching the hypervisor and virtualization software. So this is the most critical measure. VM escape attacks often exploit vulnerabilities in the hypervisor. So keeping the hypervisor and virtualization software updated closes known security holes and number two disabling unused virtual network adapters. This reduces the attack surface by preventing unnecessary communication channels between VMs and external networks and minimizes potential for lateral movement or data. So let me further clarify it with the help of this diagram. So"
YBF9c2mCGME,2,"for lateral movement or data. So let me further clarify it with the help of this diagram. So this is how the virtualization works. So at the base we have the hardware on top of the hardware we have the hypervisor and on that hypervisor then we make different virtual machines. So basically the hypervisor is the controlling mechanism or the operating system that control resources to the VMs as well as their communication and these VMs are not supposed to directly interact with the hypervisor or with the other VMs without any control mechanism. So if due to any security vulnerability the VMs are able to escape from there this sandbox environment and the VM is able to access the host that is hypervisor or other VMs then these type of attacks are known as VM escape attacks because the VM is able to escape from its own sandbox environment. Question number two. A financial services company is designing a new transaction processing system. The system must be capable of handling high volumes of transactions without any downtime and must also efficiently distribute processing loads. Considering the requirements of high availability, fall tolerance and efficient load distribution, which of the following technologies should be implemented? Again we have to select two options and the options are option A load balancing, option B clustering, option C single server deployment and option D redundant power supply. And the correct options are option A load balancing and option B clustering. And the explanation is so for a high volume transaction processing system that requires a high availability fall tolerance and efficient load distribution the following technologies are essential. Number one load balancing. The load balancing distributes incoming network or application traffic across multiple servers. This ensures efficient resource utilization, improves response times and supports fall tolerance by res by rerouting traffic away from failed server. What does this mean? This means that if we have let's suppose three servers on the top we have load balancer. So the load balancer distribute traffic among these server and if due to any reason one of the server fails the traffic is no longer sent to this"
YBF9c2mCGME,3,"server and if due to any reason one of the server fails the traffic is no longer sent to this server rather it is rerouted and distributed among the remaining servers. Number two clustering. So clustering involves grouping multiple servers to work together as a single system. This provides high availability and fall tolerance and if one server or node fails other can take over without service interruption. Question number three. A large corporation recently deployed a new enterprise resource planning that is ERP system. Post deployment, the IT team discovered compatibility issues with existing applications causing disruptions in business operations. This situations highlights a failure in the change management process. What should be the primary focus to improve change management practices for future deployments? And the options are option A conducting comprehensive user training sessions post deployment. Option B, increasing the budget for future IT projects to allow for more advanced solutions. Option C, implementing a thorough testing and validation phase before deployment. And option D, focusing exclusively on the speed of deployment to minimize downtime. And the correct option is option C implementing a thorough testing and validation phase before deployment. And the explanation is so the primary failure in this scenario is that compatibility issues with existing applications were not identified before deploying the new ERP system. This indicates that the testing and validation phase were either inadequate or skipped altogether. So a thorough pre-eployment testing phase helps identify compatibility and integration issues, stimulate the production environment and reduce the risk of post deployment disruptions. So this is a core component of effective change management process. Question number four. In determining the annualized loss expectancy that is a for various risks in a corporate network, what factors should the risk management team consider in their calculations and we have to select two options and the options are option A the cost of cyber security insurance premiums. Option B, the potential financial impact of each identified risk. Option C, the frequency of occurrence for each identified risk. And option D, the budget available for implementing security controls. And the correct options are option B the potential financial impact of each identified"
YBF9c2mCGME,4,"available for implementing security controls. And the correct options are option B the potential financial impact of each identified risk and option C the frequency of occurrence for each identified risk. So let me go through the explanation. So analyzed loss expectancy that is Ale is calculated using the formula. So, Ale is equal to SLE that is single loss expectancy multiplied by ARO that is analyzed rate of occurrence where SLE or single loss expectancy is equal to the financial impact of a single occurrence of a risk and a rate of occurrence is equal to the expected frequency the risk will occur in a year. So together these give a monetary estimate of expected annual loss due to a specific risk. Question number five. A company prevented direct access from the database administrators workstation to the network segment that contains database servers. Which of the following should a database administrator use to access the database servers? And the options are option A jump server, option B radius, option C HSM. HSM is hardware security module and option D load balancer. And the correct option is option A jump server. So what is a jump server? A jump server, also called a jump host or a jump box, is a secure server that acts as an intermediary between you and the servers on a network. It's like a stepping stepping stone you use to securely access more restricted areas. This adds security by analyzing access. You manage access through one point that is the jump server limiting exposure. Internal servers are not directly accessible from the internet and providing audit trails logs track who accessed what adding security investigations. So this is how a jump servers looks like that. Suppose you are somewhere remote and you want to access this database servers through internet. So uh allowing this database servers to be accessed directly through internet is a security hazard. So what the organization will do that the remote administrator would first log onto the jump server and then from jump server he or she can access and manage the organization resources. So this jump server is a centralized access server that is hardened and"
YBF9c2mCGME,5,"access and manage the organization resources. So this jump server is a centralized access server that is hardened and allows only authorized users and services to be accessed. Question number six. A company is deploying a firewall to enhance its network security. Security team must choose between a firewall that operates primarily at layer 4 and one that functions at layer 7. What is a key advantage of selecting a layer 7 firewall for the purpose and why it why might it be more suitable for the company's needs? And the options are option A, a layer 7 firewall is faster because it processes less data compared to a layer 4 firewall. Option B, a layer 7 firewall provides application level security, offering more granular control over web traffic. Option C, a layer 7 firewall is easier to configure and requires less maintenance than a layer 4 firewall. And option B, a layer 7 firewall focuses on physical security, protecting network hardware from damage. And the correct option is option B. So a layer 7 firewall provides application level security. Remember application resides at layer 7 offering more granular control over the web traffic. And the explanation is that a layer 7 firewall also known as an application layer firewall operates at the top of the OSI model and provides the pecker inspection. This allows it to understand application protocol like HTTP, HTTPS, FTP and DNS etc. Inspect content and context such as specific URLs, user actions or commands and apply fine grain policies based on user identity, application behavior or content. This makes layer 7 firewalls especially useful for modern network environments where threats often hired within legitimate application traffic. So this is a visual representation of layer 7 firewall. So this is the network traffic and you can consider this as a layer 7 firewall. So this level seven firewall understand the protocols. It can inspect the content flowing through and you can apply application level policies through this firewall such as let's suppose you can apply that the HTTP traffic should be blocked while the"
YBF9c2mCGME,6,"through this firewall such as let's suppose you can apply that the HTTP traffic should be blocked while the secure HTTPS traffic will be allowed through this policy application of layer 7 firewall. Question number seven. A corporate security analyst discovers that confidential company information has been leaked online. After investigating the analyst finds spyware installed on several executives laptops which has been capturing keystrokes and screen activity. What is the most likely method through which the spyware was installed on these laptops? And the option are option A. The executive visited compromised websites that automatically downloaded the spyware. Option B, the company's email server was hacked and spyware was directly installed. Option C, an insider intentionally installed the spyware on the executives laptops. And option D, the executives use unsecured public Wi-Fi networks leading to the spyware installation. And the correct option is option A that is the executive visited compromised websites that automatically downloaded the fware. And the explanation is so this is a classic case of a drive by download attack where simply visiting a malicious or compromised website can trigger the automatic download and installation of spyware without user interaction. This method is common in real world spyware attacks expires vulnerabilities in the browser or plugins often used to target high value individual such as executives. Why other options are less likely? Option B, the company's email server was hacked. So this is this is unlikely as hacking the email server would not directly result in spyware installation on laptop. Option C an insider intentionally installed. So while possible there is no evidence in the scenario to suggest insider involvement. And option D the executive use unsecure public Wi-Fi. The public Wi-Fi may expose users to man in the middle attacks, but it does not directly install spyware unless paired with other clients. Question number eight. NIT manager discovers that the organization's data encryption standards are outdated, potentially exposing sensitive data to security risk. Considering the principles of due diligence and care, what is the most appropriate action for the IT manager to"
YBF9c2mCGME,7,"Considering the principles of due diligence and care, what is the most appropriate action for the IT manager to take? And the options are option A, ignore the issue assuming the risk is minimal. Option B, inform senior management and propose updating the encryption standards. Option C, wait for security incident to occur before taking action. And option B transfer the responsibility to another department. And the correct option is option B inform the senior management and propose updating the encryption standard. And the explanation is so under the principles of due diligence that is being aware of risk and due care that is taking action to mitigate those risks. The IT manager is obligated to identify the outdated encryption as a risk. Proactively communicate this issue to senior leadership and recommend updating the standards to align with current best practices and compliance requirements. Why the other options are incorrect? Option A, ignore the issue. This violates both due diligence and due care, exposing the organization to avoidable risk. Option C, wait for a security incident. So reactive behavior shows negligence and may result in legal liability or data breaches. And option D transfer the responsibility avoiding accountability without action breaches. professional and ethical responsibilities. Question number nine. An organization's internetfacing website was compromised when an attacker exploited a buffer overflow. Which of the following should the organization deploy to best protect against similar attacks in the future? And the options are option A NG firewall that is next generation firewall. Option B W AF that is web application firewall. Option C TLS that is transport layer security and option D SD van that is software defined wide area in network and the correct option is option B web that is web application firewall. So this is how a web application firewall works. So let's suppose this is your destination server. These are our clients and the web application firewall or web sits between the server and the client so that it filters all the traffic and only allows the legitimate traffic while block the unnecessary or malicious and suspicious web traffic. So a web or web application firewall acts as a"
YBF9c2mCGME,8,"block the unnecessary or malicious and suspicious web traffic. So a web or web application firewall acts as a security guard for your web applications. It sits between your web app and the internet monitoring and filtering people. Here is the gist. So it blocks malicious traffic. Web can identify and block attacks like SQL injection and cross-sight scripting that trying to steal data or manipulate your application. Focuses on application layer. So unlike firewalls that guard your entire network, web application firewalls specifically target attacks aimed at web application and it protects for from common threats. So web application firewalls are a defense against many well-known web application vulnerabilities. Question number 10. When implementing and managing antivirus solution in an organizational settings, which two of the following best practices should be prioritized to maximize the effectiveness of the antivirus software? Select two options and the options are option A, regularly updating the antivirus software with the latest virus definitions and software patches. Option B, disabling realtime scanning to improve system performance. Option C, ensuring that antivirus software is installed on all endpoints, including mobile devices and servers. And option D, limiting user privileges to prevent the installation of unauthorized software. And the correct option is option A regularly updating the antivirus software with the latest virus definitions and software updates. And option C ensuring that antivirus software is installed on all endpoints including mobile devices and servers. And the explanation is so to maximize the effectiveness of antivirus solutions in an organization the following best practices are critical. A regularly updating the software antivirus software with the latest virus definitions and software pages. This ensures protection against new and evolving threats and software software patches address vulnerabilities in the antivirus program itself. Ensuring that antivirus software installed are all endpoints including mobile devices and servers. Comprehensive coverage ensures no device becomes a weak point. Mobile devices and servers can be targeted in attacks just like the desktops. Question number 11. During a routine audit, it discovered that a recent network configuration change although minor was implemented without going through the formal approval process. This"
YBF9c2mCGME,9,"discovered that a recent network configuration change although minor was implemented without going through the formal approval process. This change inadvertently created a security vulnerability that was exploited leading to a data breach. What does this incident primarily highlight about the importance of the approval process in change management and the options are option A the need for continuous monitoring and automated security systems. Option B, the significance of following protocol for even minor changes. Option C, the importance of regular security training for IT staff. And option D, the relevance of having a robust incident response plan. And the correct option is option B the significance of following protocols for even minor changes. So the scenario describes a change made without following the formal approval process which resulted in a security vulnerability and data breach. This directly highlights the importance of adhering to proper change management protocols even for what may seem like minor modification. Option A, C and D are generally important for security but are not the primary lesson emphasized by this incident. Question number 12. A financial institution contracts a thirdparty IT firm to upgrade its transaction processing system as outlined in a detailed statement of work or S. So, the S. So, includes specific security requirements and deadlines. Halfway through the project, the institution realizes that the firm is not meeting these specified security requirements. What is the most appropriate initial action for the institution to take in this situation? And the options are option A, immediately terminate the contract and seek legal action. Option B, engage in discussion with the firm to address non-compliance with the S so or statement of work. Option C, overlook the security shortcomings to avoid project delays. And option D take over the project and complete the upgrade internally. And the correct option is option B engage in discussion with the firm to address to address non-compliance with the statement of work. So the most appropriate initial action when a third party vendor is not meeting contractual requirements is to communicate the issue and attempt to resolve it collaboratively. The S so is a binding document and the"
YBF9c2mCGME,10,"communicate the issue and attempt to resolve it collaboratively. The S so is a binding document and the vendor should be held accountable but engaging in discussions allows the institution to clarify expectations, reinforce compliance and possibly get the project back on track without escalation. Option A, immediate termination and legal action is a last resort after attempts to resolve the issue fail. Option C, overlooking security issue is negligent and could lead to compliance violations or data breaches. And option D, taking over the project is drastic and may not be feasible without breaching the contract. So option B demonstrates due diligence and good vendor management. Question number 13. An organization's email security system automatically quarantines a batch of emails that are suspected of containing fishing links. Upon manual review, the IT team finds that some of these emails are legitimate business communications. What is the most likely reason for this mclassification and what action should the organization take to prevent such occurrences in the future? And the options are option A inate spam filters update email security spam filter settings. Option B overly aggressive quarantine settings fine-tune the email security systems heristics. Option C, lack of user training. Conduct a fishing awareness training program. And option D, malfunctioning antivirus software replace the antivirus solution. And the correct option is option B overly aggressive quarantine settings fine-tune the email security system heristics. So the issue described is false positives that is legitimate email being incorrectly flagged as fishing. This most commonly occurs when the email security system heristics or filtering thresholds are too strict. Fine-tuning these settings helps improve accuracy and reduce disruptions to legitimate business communication. Option A is incorrect because it's not about inadequate filtering but over filtering. Option C relates to user behavior not system level mclassification and option D is unrelated antivirus software is not responsible for email quarantine rules. Therefore option B addresses both the cause and the best corrective action. Question number 14. A small business has recently implemented a new customer relationship management that is CRM system. After a data"
YBF9c2mCGME,11,"A small business has recently implemented a new customer relationship management that is CRM system. After a data breach, it is found that sensitive customer data was exposed. In this scenario, who should be identified as the risk owner for the CRM system and what action should they prioritize? And the options are option A the customer service manager focusing on customer communication and support and B the sales manager concentrating on mitigating potential sales impact. Option C the IT administrator focusing on securing the CRM system and preventing future breaches. And option B the marketing manager focusing on reputation management and public relations. And the correct option is option C, the IT administrator focusing on securing the CRM system and preventing future breaches. And the explanation is so the risk owner is the individual responsible for managing and mitigating risks associated with a specific asset in this case the CRM system. Since this system involve technical infrastructure and data security the IT administrator is best positioned to understand the technical vulnerabilities and implement security controls. Option A, customer service manager is responsible for handling affected customers but not for managing the technical risk. Option B, sales manager may face business impact but is not responsible for system security. And option D marketing manager may handle PR that is public relation but again not the risk owner of the system itself. So thus option C is the correct and most appropriate choice. Question number 15. An online retailer has noticed a pattern of fraudulent transactions originating from certain IP addresses to effectively monitor and identify such activities in the future. Which detective control should the security team focus on implementing? And the options are option A installing a web application firewall that is web. Option B setting up a system for realtime transaction monitoring. Option C implementing two factor authentication for customer login. And option D conducting regular vulnerability assessments. And the correct option is option B setting up a system for realtime transaction monitoring. And the explanation is so detective controls are designed to identify and alert on suspicious activities after they occur or while they are in progress. A real-time transaction monitoring system helps detect fraudulent patterns"
