video_id,chunk_number,Processed_Text_chunk
3EgYr7jR4NI,33,"be a good match for the team and company culture. At the same time, you want to ask questions to help you decide if the team and company culture are a good match for you. The other portion of the interview is the technical interview. This is when the interviewer will ask you specific questions about technical skills related to the role. You might be asked how you would respond to a specific situation or to explain a technical concept that's listed on your resume. Do your best to answer these types of questions confidently and concisely based on your current knowledge. It's OK to say that you don't know the answer to a question or that you need a moment to respond so you can think about your answer. Employers respect honesty. Just follow up with an explanation of how you would figure out the answer, either by researching it or collaborating with the team. Even after you've completed this certificate program, you'll still have access to all of the content. So before the interview, go back and review your notes, the glossary, and any concepts that you might need to refresh your memory on. This can help you feel prepared for the questions you'll be asked. Remember, you can prepare for the interview by participating in a mock interview, reviewing the job description, and taking a few deep breaths before the interview begins. You've learned a lot in this course and are ready to move ahead and find a position as a security analyst. Coming up, we'll discuss how to conduct pre-intervew research. Previously, we discussed how to create a resume and what to expect during an interview. In this video, we're going to cover a few more things that you need to do to prepare for the interview and that could help set you apart as an excellent candidate"
3EgYr7jR4NI,34,"prepare for the interview and that could help set you apart as an excellent candidate for the position. Before the interview, it's important to do some research about the organization you're interviewing with. Interviewers want to know that you're a good match for their team and that you value the things that are important to the company. It's just as important for you to decide if the company matches your values. So make sure you know the organization's mission and vision. Understand their core values and company culture. This information is usually easy to find, either in the job description or on the About page of the organization's website. Think about why these values and the company culture are also important to you. Then practice how you will communicate this to potential employers. Remember that you will not be the only applicant for the position. Consider what sets you apart from other candidates, and be prepared to emphasize those qualities during the interview. What about your skills, experience, or work ethic make you the best match for this position? How do your goals align to the goals of the organization? You want the employer to remember you after they've interviewed several candidates. So highlight things that make you the best candidate for the role. You also want to think about the employer's perspective. The organization has needs that must be met by filling the position. They may have productivity or compliance goals, or the team might be growing because the company is expanding. Take some time to think about what the interviewer is seeking in a candidate. Then prepare yourself to state directly how you can meet the employer's needs. The interviewer may have reservations about hiring you because of your lack of experience as a security analyst. If this comes up in the interview, be prepared to address any possible concerns by speaking about your strong work ethic. This could include an ability to"
3EgYr7jR4NI,35,"possible concerns by speaking about your strong work ethic. This could include an ability to learn quickly based on feedback or to collaborate and communicate with others. Also, you could discuss having a security mindset or problem-solving skills that you've developed from personal life, work, or educational experiences. Learning about the organization's culture and mission and preparing to demonstrate how you can add value to the team are essential. It's also a good idea to write down questions that you can ask the interviewer about the organization's past accomplishments and future goals. This shows potential employers that you've done your research and care about the organization's success. Coming up, we'll discuss how to build rapport with interviewers. In this video, we'll explore a topic that can contribute to your success during the interview process-- how to build rapport with your potential employer. Rapport is a friendly relationship in which the people involved understand each other's ideas and communicate well with each other. Building rapport begins with the very first interaction you have with the company staff by phone, email, or video conference. It's important to use a professional tone in the email you write expressing your interest in the job. But it's also important to be polite and friendly. Expressing appreciation for being considered and having the potential opportunity to interview is one way to build rapport. When and if you have an initial phone screen, you can use a friendly, conversational tone of voice. To do this, try smiling while you talk. And while it's true that nobody can see you smile on a phone call, smiling while you talk can make you sound friendlier. During the phone screening and in-person interview, you can ease interview nervousness by engaging actively in a way that feels natural to you. That can mean simply saying,"
3EgYr7jR4NI,36,"that feels natural to you. That can mean simply saying, hello, nice to meet you. You can even start a short, friendly conversation by asking the interviewer how their day is going. Or if the weekend just passed, you might ask the interviewer, how was your weekend? Make eye contact when you ask these questions during an in-person interview. Or be sure to look directly into the camera during a video interview. This will show the interviewer that you're engaged in the conversation. Oftentimes during the second half of an interview, the interviewer will ask if you have any questions for them. As we discussed earlier, it's important to have some questions prepared to ask at this point. Here are some suggestions. You could ask, what is the biggest challenge I might face coming into this role, and how would I be expected to meet that challenge? Or you might ask, what would you say is the best part about working for this company? Or what is a typical day like for an analyst? Another great question is, what is the potential for growth in this role? Asking questions shows that you're engaged in the conversation and are interested in the company and the position. It also shows the employer that you are confident and that you want to make sure that their company is a good match for you before you make a commitment. It's nice to send a follow-up email a day or two after your in-person interview. This is just a brief email thanking the interviewer for the opportunity to meet with them and learn more about the organization. It's also a good idea to mention something specific from your interview in this email. It shows that you were actively engaged in the conversation. Remember, the employer is probably interviewing other candidates. So sending a"
3EgYr7jR4NI,37,"employer is probably interviewing other candidates. So sending a follow-up email will help set you apart and remind the interviewer of your discussion. Building rapport with the interviewer and other employees is an important skill when interviewing for your first security position. Writing friendly but professional emails before and after the interview and engaging in friendly conversation during the interview can help set you apart as a great candidate for the job. Welcome back. Preparing for job interviews in the security field is such an exciting process. You've learned a lot through this program that can help you stand out as a candidate. Let's discuss some useful interview strategies to consider when speaking to an employer. Your interviewer is going to ask several questions when you meet. Carefully consider each question before responding. Let's discuss the STAR method, which can help you prepare for interviews. The STAR method is a technique used to answer behavioral and situational interview questions. Using this method is a great way to help you understand each interview question and provide a thoughtful and thorough response. STAR stands for Situation, Task, Action, Result. The STAR method is typically used to answer open-ended questions, such as, tell me about a time when you encountered a challenge on the job. Let's go through an example of how this question could be answered using the STAR method. The situation-- two people needed to stay home from work due to illness, and I was the only person available to assist customers. The task-- I needed to answer phone calls from customers while assisting shoppers in the store. The action-- I came up with a strategy that allowed me to assist customers as they entered the store while also ensuring that customers who called were helped or politely placed on hold until I was able to address their needs. The result-- I managed the"
3EgYr7jR4NI,38,"to address their needs. The result-- I managed the in-store operations for the day without many mistakes, and my manager complimented me during the next team meeting. Hopefully this example highlights the benefits of answering open-ended interview questions using the STAR method. But the STAR method isn't the only strategy you can use during an interview. You can also answer questions with confidence. One way to demonstrate confidence is by admitting when you don't know something. For example, if an interviewer asks you to discuss a skill that you don't have, it's OK to admit you haven't learned it yet. However, the trick is to confidently mention that, while you don't have that particular skill, you're a quick learner and eager to develop that skill. Treat it as an opportunity to emphasize your ability to adapt and learn on the job, which shows confidence. You know what else shows confidence? Taking the time to fully understand a problem or question to provide the best solution or answer possible. When interviewing, don't be afraid to ask the interviewer for a moment to think about your answer. It shows that you're willing to take the time needed to understand the question and provide a response that is meaningful and relevant. We've discussed a few strategies that can help you overcome the nervousness you may feel about interviewing for a job. Coming up, we'll continue to explore ways to prepare for interviews. In this video, we'll take a little time to discuss additional strategies you can use during a job interview. In past job interviews, your potential employer may have asked, do you have any questions for me? This type of question can be an opportunity for you to show the interviewer that you're prepared and ready to have"
3EgYr7jR4NI,39,"interviewer that you're prepared and ready to have a meaningful conversation with them. A big part of interview preparation is researching the company before the interview because it will allow you to ask questions that demonstrate you took the time to learn about the organization and its needs. For example, if you discover that the company suffered a major security breach two years ago, don't be afraid to ask about it. One question you could ask is, what do you think is the main reason the company suffered a breach two years ago? And follow that question up with, how could my role on the security team help prevent a breach like that in the future? These kinds of questions show that you are passionate about your career and that you want to help the company strengthen its security posture. There are also some general questions you can ask the interviewer to determine if the job and the organization itself are a good match for you. Here are some examples. What's the biggest challenge for a new person in this role? In what ways can I contribute to the success of the team and the organization? What qualities or traits are most important for working well with the team and other stakeholders? Questions like these can help you develop rapport with the interviewer and show that you're interested in learning more about the role and the organizational culture. Interviewing for jobs can be a really exciting process when you're prepared, and asking questions is an essential part of the interview process. Don't be afraid to ask potential employers tough questions. This will help them understand you as a thoughtful, curious person who can add value to the team. Coming up, we'll discuss another strategy-- the elevator pitch. Now let's discuss a concept that can help you identify your strengths and allow you"
3EgYr7jR4NI,40,"that can help you identify your strengths and allow you to highlight those strengths to others-- an elevator pitch. An elevator pitch is a brief summary of your experience, skills, and background. It's called an elevator pitch because it should be short enough to say in 60 seconds or less, which is the average amount of time you might spend talking with someone on an elevator. Elevator pitches allow you to demonstrate who you are to potential employers in a very short time span. They can be used at job fairs, career expos, and other networking situations, like professional conferences and social media job sites, such as LinkedIn. Now let's examine how to create an elevator pitch. Your elevator pitch needs to be short and persuasive. There's no need to list all of your previous experiences and accomplishments. Instead, explain who you are and why you care about being a security professional, as well as the qualifications and skills you have that are specifically related to getting a job as a security analyst. For example, critical thinking, problem solving, and the ability to build collaborative relationships with others are transferable skills that most organizations are looking for. So highlight those in your elevator pitch. You could also mention technical skills you've learned in this certificate program, such as using various SIEM tools and programming languages like SQL and Python to identify and respond to risks. Now we'll cover a few things to avoid when delivering your elevator pitch. It's important to avoid rambling or sharing irrelevant details during your elevator pitch. Potential employers only want to know who you are and why they should consider you for a security role. As you develop your elevator pitch, you're going to want to practice it several times. However, don't practice it so much that you end up sounding ingenuine or robotic when it's time to"
3EgYr7jR4NI,41,"practice it so much that you end up sounding ingenuine or robotic when it's time to share your pitch with a possible decision-maker. Instead, speak naturally, like you're having a conversation, when you give your elevator pitch. That will help keep people engaged and interested in what you're saying. Another thing to avoid-- speaking too quickly. Because an elevator page is fairly short, it can be easy to rush through it. But that can cause people to miss out on some key skills you have to offer simply because you sped past them. One last tip-- search the internet for elevator pitches to find examples that may help you generate ideas for your own pitch. In essence, your elevator pitch is a way to tell people why you are an amazing candidate for a security position, with great skills and a clear direction for what you want to do in your career. While it's natural to be nervous when speaking to potential employers, just remember, take a deep breath, gather your composure, and deliver your pitch with confidence, conviction, and at a normal pace. You'll be just fine. You've done a great job completing this section of the course. Let's take a moment to review what we've covered. We started by discussing how to find and apply for jobs in the security field. Then we explored how to create your resume. Next, we shared some strategies to develop rapport with interviewers. We also covered how to use the STAR method to answer open-ended interview questions thoughtfully. We finished by discussing how to develop an elevator pitch. Hopefully this has helped you feel confident as you begin to search and apply for jobs in the security field. Good luck. Congratulations on completing the final course of the certificate program. We covered a lot of information. So let's take a"
3EgYr7jR4NI,42,"moment to review. We started by discussing how to protect assets and communicate incidents by developing a security mindset. Then we covered when and how to escalate incidents to the appropriate team members to make sure that small issues don't become big problems for an organization and the people it serves. Next, we explored ways to communicate effectively to influence stakeholders' decisions related to security. This included discussions about how to use visuals to convey important information and sending emails, making phone calls, or sending instant messages. After that, we shared some ways to engage with the security community, including attending conferences and connecting with other analysts through a networking site. Then we moved on to the final section of the course, which covered how to find, prepare for, and apply for jobs. This included discussions about how to create a compelling resume and tips to help you navigate the interview process. It's been an absolute pleasure guiding you through this journey. This certificate covered some rigorous security content. You could have given up at any point, but you didn't. And for that, you deserve to be proud of yourself. As we discussed at the beginning of this program, the security field is growing and in need of security professionals just like you to help protect organizations around the world and the people they serve. The knowledge and skills you've obtained throughout this certificate program will allow you to begin applying for entry-level security analyst jobs. Now let's take a moment to summarize what we've discussed throughout this program. We started by exploring core security concepts, including the definition of security and core skills. Then we covered the focus of eight security domains and discussed how security supports critical organizational operations. Following that, we discussed network security, including network architecture and the mechanisms used to secure an"
3EgYr7jR4NI,43,"discussed network security, including network architecture and the mechanisms used to secure an organization's network. In the next course, we turned our focus to computing basics for security analysts. In this section, we introduced Linux and SQL. After that, we explored assets, threats, and vulnerabilities in depth. This included discussions about how assets are classified and the security controls used by organizations to protect valuable information and minimize risks. In the next course, we focused on incident detection and response. Here, we defined what a security incident is and explained the incident response lifecycle. In the following course, we introduced the Python programming language and explored how to develop code related to common security tasks. Finally, in the last course of the program, we explored topics related to your pathway into the security profession, including how to find and apply for jobs. You put a lot of valuable time and energy into completing this certificate program. Remember that the learning doesn't stop here. As you move forward in your career, always be mindful of the new trends developing in the world of security. As technology continues to advance, the threats to organizations and people will evolve as well. It's up to you to stay informed and always be willing to learn. You just completed the Google Cybersecurity Certificate. What a remarkable accomplishment that shows just how committed you are to learning new skills that will allow you to pursue your career goals. On behalf of myself and my fellow course instructors, congratulations. SPEAKER: Congratulations, you did it. SPEAKER: Congrats. I can't wait to see how many of you decide to pursue this career"
3EgYr7jR4NI,44,"how many of you decide to pursue this career and visit some really cool places in cybersecurity. SPEAKER: Way to go. Congratulations. SPEAKER: Congratulations. SPEAKER: You're a rock star. SPEAKER: Congratulations. SPEAKER: Congratulations. DION: Great job. you did it. Congratulations. SPEAKER: Congratulations. I am rooting for you and wishing you continued success. SPEAKER: Congratulations on your big accomplishment. Now it's time to get to work. SPEAKER: This is probably one of the best decisions you've ever made. And I can't wait to hear about all the opportunities that you're going to experience. SPEAKER: Congratulations. SPEAKER: Congratulations, you've made it to the end, and you're now ready to keep everyone safe online. SPEAKER: Congratulations. Continue to learn. Continue to grow. You'll find this is a very rewarding career. SPEAKER: Congratulations. You did it. Welcome to cybersecurity. SPEAKER: The adventure continues after this. SPEAKER: There's still a lot more to explore in the world of security. But you're off to a great start. EMILY: It's been my pleasure guiding you through the final part of this program. I know you're well prepared to begin or continue a remarkable career in security. Congratulations, and best of luck on your journey. [MUSIC PLAYING]"
_AadMC3mzSk,1,in this video we will break down every single acronym you need to know for the Security Plus exam from AAA to xss we will not only Define them but also explain them with real world examples and visuals to make them stick so grab a notebook hit that like button and let's dive into the Ultimate Security Plus acronym guide that will simplify your study Journey Tria a that is authentication authorization and accounting so authentication is the process of verifying the identity of a user device or a system to ensure that only authorized entities gain access to resources examples it typically involve validating credential such as passwords that is something you know it is a type of authenticating factor that is something you know biometric such as fingerprint which is the authenticating factor type something you are or security token which is which is the authenticating factor type something you have similarly authorization authorization is the process of determining and granting a user's permission to access specific resources performs certain actions or use particular Services based B on their verified identity authorization usually takes place after authentication so typically user first logs in using the authenticating factor such as username and password and then the user is able to perform certain action as per their authorization and the third one is accounting accounting or auditing refers to tracking and recording a user's activity such as access to resources performed actions and system usage example include login and log out logs command execution logs Etc that is Access Control list so a list of rules that controls who can access or modify resources like files or network devices it defines permissions for users or systems based on criteria such as IP headers or user identity example include a firewall ACL blocks traffic from suspicious IP addresses AES that is Advanced encryption standard so a secure encryption method used to protect data by transforming it into a into an unreadable format it uses symmetric Keys meaning the same key is used for encryption and decryption examples as is commonly used for securing Wi-Fi networks and encryption of sensitive files ah that is authentication header so authentication header is a protocol in the IP sex suit that provides data integrity and authentication for IP packets it ensures
