video_id,chunk_number,Processed_Text_chunk
_AadMC3mzSk,23,allowing secure Communications as if they were directly connected by a physical link while G does not encrypt the data itself sorry let me get back it while the G does not encryp the data itself it can be paired with IP sec to ensure confidentiality of the traffic between the two locations H that is high availability so H High availability ensures that a system or service remains operational and accessible with minimal downtime even during failures or maintenance it often involves redundant components and fail or mechanisms for example a web server cluster uses ha by by Distributing traffic across multiple servers so if one server fails another takes over without interrupting service HDD that is hard disk drive so HDD hard disk drive is a data storage device that uses spinning magnetic disc to store and retrieve digital information it is commonly used in computers servers and other other devices for long-term data storage example A 1 TB HDD in a desktop computer stores operating systems application and personal files like documents and photos HS that is host based intrusion detection system so HIDs monitors a single device or host for suspicious activities or policy violations by analyzing logs file changes and system Behavior it focuses on detecting attack specific to that host example and an H an HIDs on a server might alert administrators if unauthorized changes are made to system files or if unusual login attempts are detected hips that is host based intrusion prevention system hips host based intrusion prevention system is a security solution installed on individual devices that is host that are not only detects that not only detect suspicious activities like HIDs but also actively prevents potential threats by blocking malicious actions in real time example an hips on a laptop might block a malicious script trying to modify system files or prevent unauthorized applications from running HP that is hm based one time password HP hm hm based one time password is a onetime password algorithm that generates unique time independent password based on a counter and a shared secret key each password is valid until it is used example a user logs into an online service using an hotp token which generates a new onetime password whenever the button is pressed HSM that is Hardware security
_AadMC3mzSk,24,token which generates a new onetime password whenever the button is pressed HSM that is Hardware security module the HSM Hardware security module is a physical device designed to manage store and protect cryptographic keys and perform encryption and decryption operations it provides a secure environment for cryptographic process ensuring data confidentiality and integrity example Banks use hsms to securely manage encryption keys for ATM transaction HTML that is hypertex markup language HTML is the standard language used to create and structure content on web pages it uses tags to Define elements like headings paragraphs links images and tables example a simple HTML code snippet that is H1 welcome to my website H1 closed creates a head heading on a web page HTTP that is hyper Tex Tex transfer protocol HTTP hypertext transfer protocol is a protocol used for transferring data between a web browser and a web server it facilitates the loading of web pages by sending request and receiving responses in plan text example when you enter HTTP colum power/ example.com in a browser and HTTP request is sent to the server which responds with the web page web page content HVAC that is heating ventilation and air conditioning the HVAC refers to systems that control indoor temperature air quality and humidity in buildings to provide comfort and maintain equipment functionality example data centers rely on hway system to keep servers cool and prevent overheating IAS that is infrastructure as a service so IAS infrastructure is a service is a cloud computing model that provides virtualized Computing resources or the internet such as virtual machines storage and networking without the need for on premises Hardware example Amazon web services that is AWS offers Ias or infrastructure is a service allowing businesses to rent virtual servers and storage on demand I that is infrastructure as code so IC infrastructure as code is a practice in cloud computing where infrastructure is managed and provisioned using Code rather than manual processes it allows developers and operations operations teams to automate and Version Control infrastructure setups example using terraform or AWS cloud formation a company can Define and deploy server configurations networks and databases automatically by writing code ensuring consistent and repeatable infrastructure deployments IM am identity and access management I M identity
_AadMC3mzSk,25,automatically by writing code ensuring consistent and repeatable infrastructure deployments IM am identity and access management I M identity and access management is a framework that manages the identities of users and devices within an organization and controls their access to resources ensuring that only authorized entities can access specific data or system example AWS allows administrators to create and manage users and permissions ensuring that employees have access only to the resources they need to perform their job functions icmp that is internet control message protocol icmp internet control message protocol is a network protocol used to send error messages and operational information about network communication it helps diagnose network issues and manage data flow example ping uses icmp to send Eco request and receive Eco replies to test if a device is reachable or a network as seen here IC that is industrial Control Systems IC industrial control system refers to systems used to Monitor and control industrial processes such as manufacturing energy production and water treatment ICS typically includes hardware and software to automate and optimize operations example scod supervisory control and data acquisition systems are a type of I used to Monitor and control large scale industrial processes like electrical grids or oil pipelines idea that is international data encryption algorithm idea or international data encryption algorithm is a symmetric key block Cipher used for encrypting data it was designed to provide a high level of security while being efficient in hardware and software implementations example idea was commonly used in pgp that is pretty good privacy for Email encryption IDF that is intermediate distribution frame so IDF intermediate distribution frame is a type of equipment used in telecommunications and networking to connect and and organized cable between the main distribution frame and various endpoints or devices within a building or campus example in a large office building an IDF might be located on each floor where it houses switches and Page panels to distribute network connections from the main server room IDP that is identity provider IDP identity provider is a system or service that manages and authenticates user identities and provides access to services or applications it is a critical component in single sign on that is SSO Solutions example Google acts as an IDP when users sign into multiple applications like Gmail
_AadMC3mzSk,26,that is SSO Solutions example Google acts as an IDP when users sign into multiple applications like Gmail or YouTube using the using their Google account credentials IDs that is intrusion detection system IDs intrusion detection system is a security system that monitors Network or system activities for malicious activities or policy violations it alerts administrators when suspicious activities are detected example a network IDs monitors traffic for unusual pattern such as Port such as Port scanning or denial of service attacks i e that is Institute of electrical and electronics Engineers the i e Institute of electrical and electronic Engineers is a professional organization that develops and publishes standards for for a wide range of Industries including Electronics telecommunication and Computing example the i e 02 Point sorry let me get back the i e 802.11 standard defines the protocol for wireless local area networks that is W lens commonly known as WiFi I that is inter interet key exchange the I internet key exchange is a protocol used in VPN that is virtual private networks to establish a secure and authenticated Communication channel between two devices it negotiates the cryptographic parameters to be used in communication and handle the exchange of encryption Keys example I version 2 is a more secure and efficient version of I often used used in ipvpn to provide encryption and secure key exchange between a client and a server I am that is instant messaging I instant messaging is a form of realtime communication between two or more people over the Internet it allows users to send and receive text messages multimedia and files instantly example WhatsApp and Slack are popular IM platform used for personal and business communication IMAP that is internet message access protocol the IMAP internet message access protocol is a protocol used by email clients to retrieve messages from a mail server unlike POP 3 IMAP allows emails to be stored on the server enabling access from multiple devices and syncing email actions like reading or deleting across all devices example Gmail uses IMAP to allow users to access their emails on different devices such as phones tablets and computers while keeping the inbox synchronized ioc that is indicators of compromise ioc indicator of compromise refers to pieces of forensic data
_AadMC3mzSk,27,inbox synchronized ioc that is indicators of compromise ioc indicator of compromise refers to pieces of forensic data such as file hashes IP addresses or URLs that can identify potential malicious activity on a network or system they are used by security teams to detect and respond to cyber security threats example an ioc could be an IP address associated with a non bartnet which can be used to block malicious traffic in a network iot that is Internet of Things the I OT Internet of Things refers to the network of physical devices that are embedded with sensors softwares and other Technologies allowing them to connect and exchange data over the Internet example smart therates like the nest can be controlled remotely via a smartphone application adjusting the temperature in a home based on user preferences and behaviors IP that is Internet Protocol so IP Internet Protocol is a set of rules that gone how data is transmitted over a network it is responsible for addressing and routing packets of data to their destination example ipv4 uses a 32bit address format for example 19216811 for identifying devices on a network IPS that is intrusion prevention system the IPS intrusion prevention system is a security solution that actively monitors Network or system traffic for malicious activity and takes action to block or prevent attacks in real time example an IPS can automatically block traffic from an IP address known to be associated with d dos attack that is distributed denial of service attack IPC that is Internet Protocol security the IPC Internet Protocol security is a suit of protocols used to secure internet communications by authenticating and encrypting each IP packet in a communicating in a communication session it is commonly used in VPN to ensure data privacy and integrity example IPC can be used to create a secure s to side VPN encrypting data traffic between two offices over the Internet IR that is incident response so IR or incident response refers to the process of identifying managing and mitigating security incidents or breaches in a system or network it involves detecting analyzing and responding to threats to minimize damage and restore normal operations example a company's IR team might respond to a data breach by isolating affected systems and
_AadMC3mzSk,28,"normal operations example a company's IR team might respond to a data breach by isolating affected systems and conducting a forensic investigation and notifying affected parties IRC that is Internet relay chat the IRC Internet relay chat is an application layer protocol used for realtime text communication or the internet it allows users to join Channel and send messages to groups or individuals example IC was widely used in the 1990s and early 20,000 2000s for group discussions and file sharing in communities IRP that is incident response plane the IRP incident response plan is a documented strategy that outlines how an organization should respond to a cyber security incident such as a data breach malare infection or unauthorized access to minimize damage and restore normal operations example NP might include steps like identifying the incident containing the threat eradicating malicious elements and recovering affected systems ISO that is international standards organization the iso International Organization for standardized I ization is a global body that develops and publishes International standards to ensure the quality safety and efficiency of products services and systems example ISO 27,1 is a widely recognized standard for managing information security for managing information security risk and implementing a secure information security management system that is isms ISP that is internet service provider the ISP is a company or organization that provides internet access to individuals and businesses isps offer various types of internet connections such as Broadband fiber and satellite example com cost and AT&T are popular isps that provide internet services to homes and businesses in the US isso that is information system security officer isso or information system security officer is a role within an organization responsible for overseeing and for overseeing and ensuring the security of information system the isso develops implements and manages policies procedures to protect the organization's data and it infrastructure example an isso may work with the IT department to ensure compliance with security regulations such as Hippa or gdpr IV that is initialization Vector the IV initialization Vector is a random value used in encryption algorithms to ensure that the same plan text encrypts differently each time even when the same key is used it adds an extra layer"
_AadMC3mzSk,29,same plan text encrypts differently each time even when the same key is used it adds an extra layer of security by preventing the repetition of cyer Cipher text pns example in AES encryption an IV is used to initialize the cipher before encrypting encryption begins ADC that is key distribution center ADC or key distribution center is a server used in network security to authenticate users and distribute encryption Keys it is a central component of the karos Authentication Protocol ensuring that both users and services are securely authenticated example in Kos authentication the KDC issues ticket granting tickets to users and service tickets to allow secure access to resources within a network K that is key encryption key so k key encryption key is a key used to encrypt other cryptographic Keys providing an additional layer of security for Key Management it helps protect sensitive Keys such as data encryption Keys during storage or transmission example in a disk encryption system K ke may be used to encrypt the data encryption key which is which in turn is used to encrypt the data on the disk l2tp that is Layer Two turn link protocol so lt2p Layer Two turn link protocol is a protocol used to create virtual private Network that is VPN connections by tunneling data between two points over the Internet it is often used in conjunction with IP sec to provide encryption and security for the tunnel example l2t IC is commonly used for secure side to side vpns or Remote Access VPN where data is tunneled through an encrypted connection between client and server Lan that is local area network so Lan is a network that connects computers and devices within a limited geographical area such as a home office or campus it allows devices to share resources like files printers and internet connections example in an office a lan might be used to connect all computers printers and servers to share files and access the internet through a central router leap or leap that is lightweight extensible Authentication Protocol so leap lightweight extensible Authentication Protocol is a deprecated Authentication Protocol used in wireless networks to provide secure authentication between a client device and a wireless access point it was developed by Cisco but has since
_AadMC3mzSk,30,provide secure authentication between a client device and a wireless access point it was developed by Cisco but has since been replaced by more secure protocols like like WPA2 example leap was commonly used in corporate wireless networks before being replaced by WPA2 that is Wi-Fi protected access to for better security features Mac that is mandatory access control so Mac mandatory access control is a security model where access to resources is regulated based on the classification of the data and the clearance of the user or system in Mac security policies are enforced by the system and users cannot change or override them example in a military system Mac might be used to ensure that only users with the appropriate security clearance can access classified information again mag that is Media access control so mag sorry so this is the uh we are here we are talking about the media access control or Mac address while the explanation is for the uh mandatory access control so one Mac is mandatory Access Control another is the MAC address which we all know that is the MAC address of your network card such as your Wi-Fi card your ethernet card and this is uh 48 bit as you can see here these are hexade decimal number and this is unique for each device third Mac is the message authentication code so MEC or message authentication code is a cryptographic check sum used to verify the integrity and authenticity of a message it ensures that the message has not been altered and confirms the sender's identity by using a shared secret key example when sending a secure message the sender generates a Mac using the message content and secret key the receiver can then generate the same mag and compare it to ensure the message is authentic and unchanged man that is metropolitan area network so man metropolitan area network is a type of network that covers a large geographic area than a local area network but is smaller than wide area network it typically spans a city or a large campus and used to connect multiple lands within that area example a man can connect the offices of a company located in different buildings within a city allowing for highspeed data transfer between locations MBR that is Master
_AadMC3mzSk,31,located in different buildings within a city allowing for highspeed data transfer between locations MBR that is Master boot record so MBR Master boot record is a special type of boot record boot sector located at the beginning of a storage device such as a hard drive it contains information about the partitioning of the dis and the boot loader which helps load the operating system example the MBR typically stores the partition table which defines how the storage device is divided into partitions for example primary extended and logical md5 that is message digest 5 so md5 message digest 5 is a cryptographic hash function that produces a 1 to8 bit H value HH value typically represented as has 32 characters hexadecimal number it is commonly used to verify data Integrity ensuring that files or messages have not been altered example md5 is often used to generate check sums for files so that users can verify the files Integrity by comparing the calculated hash with the original hash MDF that is main distribution frame the MDF sorry this is main distribution frame mdfr main distribution frame is the FR frame so again here is a mismatch MDF stands for man distribution Fame as well as the master database file so here this explanation is for the master database file so Master MDF or Master database file we will go with this one uh for this particular slide is the primary file format used by the Microsoft SQL Server to store database information it contains the actual data and schema of the database including tables views and indexes example an MDF file is the core file of an SQL Server database and is typically accompanied by ldf files which store transaction logs MDM that is mobile device management so MDM or mobile device management is a set of tools and policies used by organizations to manage and secure Employees mobile devices such as smartphones tablets and laptops it allows it administrators to control access en Force security measures and remotely WIP data if necessary example MDM Solutions like Microsoft InTune or VMware AirWatch allows companies to enforce password policies track device locations and remotely disable table or VI devices in in case of
_AadMC3mzSk,32,allows companies to enforce password policies track device locations and remotely disable table or VI devices in in case of loss or theft MFA that is multiactor authentication so MFA is a security process that requires users to provide two or more verification factors to gain access to a system application or account it enhances security by combining different type of credential such as something the user know that is password something the user has such as smartphone or something the user is such as the biometric data or a fingerprint example a common MFA setup includes a password that is something you know and a onetime code sent to your phone that is something you have MFD that is multifunction device so MFD multifunction device refers to a machine or device that combines several functions such as printing scanning copying and fixing into one unit these devices are commonly used in offices to streamline operations and reduce the need for multiple individual devices example an MFD like the HP Laser Jet Pro can print scan and copy documents all of from a single machine saving space and improving efficiency in office environment mfp that is multifunction printer so mfp multifunction printer is a type of printer that combines several functions in one device such as printing scanning coping and sometimes fing mfps are commonly used in offices to increase efficiency and reduce the need for multiple devices example an mfp like the Canon Image Runner can print documents scan them into digital format and make copies all from one unit MMS that is multimedia message service MMS multimedia message service is a messaging service that allows users to send multimedia content such as pictures videos audios and text between mobile devices it is an extension of SMS that is short message service which is limited to text only example MMS is commonly used to send photo or video to a friend directly from a smartphone along with the text message M MOA that is memorandum of agreement the M MOA memorandum of agreement is a formal document that outlines the terms and conditions agreed upon by two or more parties it is used to define the rol responsibilities and expectation in collaborative project or Partnerships
_AadMC3mzSk,33,two or more parties it is used to define the rol responsibilities and expectation in collaborative project or Partnerships typically before ENT entering into formal contract example an Mo MOA between two companies might outline how they will collaborate on a new product development project including resources allocation timeline and financial contributions mou that is memorandum of understanding the mou memorandum of understanding is a formal agreement between two or more parties outlining their intentions to collaborate on a project or initiative unlike a contract it is typically nonbing and solve to clarify the roles and responsibilities of each party involved example an anou between a university and a research company might Define their shared goals for a research project including how resources will be shared and intellectual property managed without legally obligating them to specific actions MLS that is multiprotocol label switching MLS multiprotocol label switching is a data carrying technique used in high performance networks to direct data from one network node to another based on short path labels rather than long Network addresses it improves the speed and efficiency of network traffic by simplifying the routing process example MLS is commonly used by service providers to manage traffic across large scale Networks allowing for faster and more reliable data Transmissions MSA that is Master service agreement the MSA is a contract between two parties that establishes the terms and conditions for future services or transactions it serves as a framework for the relationship outlining General provision such as payment terms confidentiality and dispute resolution while leaving the specific details of individual projects are services to be determined later example a company might sign an MSA with a vendor to set the terms for the supply of goods or services over an extended period each order or project would then be G by the MSA but the specific term such as delivery dates or qualities or quantities would be detailed in a separate work order or statement of work Ms chap that is Microsoft challenge handshake Authentication Protocol Ms chap Microsoft challenge handtag Authentication Protocol is a protocol used for authenticating users in a network commonly in VPN or dialup connections it is an improvement over the older chap protocol and provides additional security features such as password encryption example
