video_id,chunk_number,Processed_Text_chunk
epgQ-sAr0l8,2,plus you name it and most of his study resources are completely free so I would highly recommend it taking advantage of that watching the entire Professor Master compt Security Plus study guide videos and use that as your first pass for all the material on the Security Plus exam number two this one is a bit more optional and that is the compy of all-in-one textbook personally when I'm studying I like multiple mediums video physical textbook online resources and practice exams so we're basically going to cover the gamut not everyone is going to want to study out of a textbook but I personally use the comp all inone textbook I rented it on Amazon when I was studying it's a pretty hefty textbook it's 600 plus pages and I read that from cover to cover but I was able to pass my Security Plus on the first try and that is not something that everyone can say and one of the big reasons I think is because of a textbook it's just very different reading something on paper compared to just skiing through it online sometimes it can feel like it sticks in your head more when you have the physical textbook in front of you but again it's not for everyone and and if you only have one month to study it then you're primarily going to be using the chapter summaries and the appendix at the end of the book so that is one of the big reasons why I think the textbook is an optional piece unless you really have the time to dedicate to reading through it and then finally the last resources are the compa Security Plus official exam objectives guide and good old AI learning tools so basically choosing the AI learning tool of your choice going on there using the CompTIA exam objectives guide and having them make you a personalized study plan for the next 4 weeks you can even tell them which areas you want to focus more on for example if you're not as familiar with network security or network protocols that you can have it create a study plan catered towards your needs and your specific learning areas that you need more help on and when I
epgQ-sAr0l8,3,plan catered towards your needs and your specific learning areas that you need more help on and when I was studying for my security plus we did not have all these AI tools so I would highly recommend it taking advantage of them to basically 2X or even 10x your study time and if you're looking for a study tool that can help you take quality notes while keeping you organized I'd recommend checking out the iFly Tech AI note Air 2 thank you to iFly tech for sponsoring this portion of the video this is currently my favorite notetaking tool because of the paper light screen and writing experience it feels like I'm writing in a notebook but it's much more portable and convenient to use and it has a built-in AI generated summary for audio transcribed notes using your chat GPT account and everything is securely synced to the cloud the realtime voice to text feature is perfect for not taking while you're watching study material for the Security Plus or any other certification or course all on on a 8.2 in e in display and if you like you can convert your handwriting to typed text so your notes are easily reviewable the next time you go through them you can also use iFly Tech doc scan to quickly scan paper documents or notes for digital access and even take notes directly on PDFs there's also a schedule management tool which I've been using as my personal daily schedule where you can automatically create TOS with your audio or handwritten notes when you Circle or store content using the pens side button then you can automatically highlight attention items to manage your schedule the feature can be activated in the settings you can also view your weekly work report which is a perfect way to track your progress the iFly Tech AI note Air 2 is the perfect study tool for certifications or anything else that you're currently studying for and something really cool about this tool is that it can also perform Real World multilanguage Translation with their voice to text feature which can be used for work meetings or any scenarios where
epgQ-sAr0l8,4,Translation with their voice to text feature which can be used for work meetings or any scenarios where you're actively taking notes even internationally which can happen more often than you think while working in cber security right now iFly Tech is having a huge discount and you can check out the iFly Tech AI note Air 2 through the link in my description and now let's get back to the rest of the video all right guys so here is the full study timeline that I would recommend starting with a high level week one is a full Security Plus exam objectives guide walkth through week two review all key Concepts in the compt Security Plus all-in-one textbook and don't forget to take notes and complete all of the chapter summary questions week number three complete Professor messer's entire CompTIA Security Plus course again this is free on Professor messer's YouTube channel and his website so feel free to use whichever resource you prefer but remember these four weeks are going to be eat sleep breathe Security Plus so you really need to log into the schedule and and take this seriously because you don't want to pay another exam fee if you don't pass the first time around and if you're following this guide and this timeline then your chances of passing are already very very high so as gen Z and gen alas a you have to lock in if you want to pass your Security Plus exam on the first drive you have to take this seriously and basically study hundreds of cybercity Concepts into 4 weeks which is definitely possible but again it's going to take a lot of work don't think that this is going to be an easy exam that you can just get under your belt after just nonchalantly studying and and not doing it with your full dedication setting for your Security Plus especially if you're a beginner with no previous experience it's going to need your full attention starting in week one which is when we cover the complete exam objectives and what this is it's basically a document created by CompTIA that will give you the full vocabulary list
epgQ-sAr0l8,5,this is it's basically a document created by CompTIA that will give you the full vocabulary list of all the exam topics all the protocols all the concepts that are on the Security Plus exam and basically all outlined in one PDF document I basically use this as a sanity checklist the first week going through this you can also cross reference through the Security Plus all-in-one textbook and this exam objectives guide because both of them will have all the concepts on the exam but just in different formats your job is to get as familiar as you can with all the topics on the exam objectives list and then week two is going to be we're diving head first into the All In textbook I highly recommend it taking a lot of good notes because you're also going to refer back to them when you're doing your practice exams and practice questions most Security Plus textbooks will also have a practice exam question or summary at the end of each chapter there's usually about 15 to 20 Questions per chapter I would always do those when I was studying for my Security Plus I also went back and re-reviewed all of the practice questions and answers before I took the official exam that's how helpful they were so definitely don't sleep on those do them again week two I don't expect everyone to be reading a textbook full on in just one week but you should at least be doing those practice questions reading through the chapter summaries going through the appendex and reading through the specific areas of the concepts and topics that you're not as comfortable with maybe you don't know anything about cryptography maybe you're not as familiar with digital forensics maybe you're not as familiar with the types of vulnerabilities and exploits then read those chapters you can jump around the textbook you don't have to read the chapter that you're already familiar with or already learned in the past in another course or any other resources we two is really about filling in the gaps for the areas that you have the most trouble with so when you see it on an exam it won't catch you off
epgQ-sAr0l8,6,you have the most trouble with so when you see it on an exam it won't catch you off guard another thing to note is that you should not be relying on memorizing acronyms for example I had someone in our Discord Channel tell me that they took their Security Plus exam but because the practice exam that they did had all the acronyms in the questions and answers spelled out for them so they didn't know that they had to actually memorize acronyms this is one of the most important things to keep in mind not everything is going to be completely spelled out in the actual exam no matter what practice questions that you do no matter what AI tool that you get to generate you practice questions you need to make sure that you're using practice questions and practice exams from multiple different sources and not just relying on one format because you can easily get screwed over by that like this person did so don't just remember the acronym also remember what the acronym stands for and what it means week number three this one should be an easier one you're basically solidifying all the information that you first learn through reading the exam objectives guide and the CompTIA Security Plus textbook and now you will be focusing on Professor mess's Security Plus course this course is video based so you don't have any more reading to do at least not as much but you're primarily going to be soaking in that information and tying it back to what you've already learned you're basically Making Connections every time you study from a new source or a new format it's going to remind you of info that you've already learned it might show you areas that you might have missed this is why I plan out the study guide this way because you're basically studying from beginning to end in week one and you're studying from beginning to end in week two and then finally one last time in week three from beginning to end of the CompTIA Security Plus material because let's face it you're basically cramming months of study material into four weeks but if
epgQ-sAr0l8,7,material because let's face it you're basically cramming months of study material into four weeks but if that's what it takes to get the Security Plus onto your resume before next year's hiring Cycles then it's going to be well worth it and finally in week number four you're going to be focusing all in on practice exams practice questions I probably did almost a thousand or more practice questions and I did at least two full-on practice exams so I treated these as real exams I timed myself obviously it was a practice exam so I was still able to review my answers and see what I got wrong but every time I answer a practice question set and I get a question wrong I always go back and try to figure out why what the correct answer was and really trying to knock it into my head to remember for next time I see something similar potentially in the real exam so when you get something wrong that is always something to keep in mind and write down so you can restudy it at least a few days before the official exam now I have a lot of exam resources I can share Linked In My description including Josh maor's Security Plus practice questions he has a really huge set of practice questions that you can use along with all the other study resources I mentioned in this video the Security Plus is a lot to study for but trust me it is going to be worth it when you finally get certified this was my first official professional certification that I've ever gotten in my career so personally I do think that it's very well worth it and it also helped me get my second job in cyber security so it is very very well worth it to have this on your resume all right that's it for this video don't forget to check out the iFly te AI note Air 2 and get their product launch discount through the link in my description thank you guys so much for watching if you have any questions feel free to drop them in the comments below don't forget to also stay connected on LinkedIn and on our Discord Channel
epgQ-sAr0l8,8,drop them in the comments below don't forget to also stay connected on LinkedIn and on our Discord Channel which are both also linked in the description where we discuss cyber security career questions share resources and chat about all things cyber security if this video was helpful please consider liking and subscribing as it really does how about the channel I post videos weekly and hopefully I'll see you guys in my next video bye
3EgYr7jR4NI,1,"DION: Hello, and welcome to the course. I am Dion, a program manager at Google. I've worked in security for the past five years in areas ranging from risk management to insider threat detection. I'll be your first instructor in this course. As a security analyst, you will help protect the assets of the organization you work for, including tangible or physical assets, such as software and network devices, as well as intangible assets like PII, copyrights, and intellectual property. Imagine if this kind of sensitive information were to be exposed by a threat actor. It would be devastating to the reputation and financial stability of the organization and the people the organization serves. In previous courses, we discussed a variety of topics that are relevant to the security profession, including core security concepts, frameworks and controls, threats, risks, and vulnerabilities, networks, incident detection and response, and programming basics. Now it's time to put all of these core security concepts to practical use. In this course, we'll further explore how to protect assets and communicate incidents. Then we'll discuss when and how to escalate incidents to protect an organization's assets and data. We'll also cover how to communicate effectively to influence stakeholders' decisions related to security. After that, Emily, your instructor for the second part of this course, will introduce some reliable resources that will help you engage with the security community after you complete the certificate program. And finally, we'll cover how to find, prepare for, and apply for security jobs. This will include discussions about how to create a compelling resume and tips to help you throughout the interview process. When I started my first security-based role, I was excited to be hired at Google to protect information and devices. I was also happy to be"
3EgYr7jR4NI,2,"Google to protect information and devices. I was also happy to be a part of a broader team that I could learn from and reach out to for support. My team helped me grow my expertise, and I'm proud of my contribution to our projects. By the end of this course, you'll have had multiple opportunities to refine your understanding of key security concepts, create a resume, build confidence in your interview skills, and even participate in an Artificial Intelligence or AI-generated interview. The security profession is such an amazing field, and I'm looking forward to you joining it. I have one question for you. Are you ready to get started? Welcome to the first section of the course. In the next several videos, we'll discuss what it means to have a security mindset and how you'll use that mindset to protect an organization's assets and data. Then we'll explore the process of incident escalation in the event of a breach. Finally, we'll share information to better help you understand the sensitive nature of the data that you'll work to protect. Coming up, we'll focus on how to develop a security mindset, then use that mindset to protect organizations and the people they serve. Let's take a little time to discuss a concept that will help you throughout your security career, having a security mindset. In previous courses, we discussed various threats, risks, and vulnerabilities and how they can impact organizational operations and the people served by those organizations. These concepts are key considerations when thinking about having a security mindset. You'll have to recognize not only what you're defending but what or who you're defending against. For example, it's important to recognize the types of assets that are essential to maintaining an organization's business functions along with types of threats, risks, and vulnerabilities that can"
3EgYr7jR4NI,3,"with types of threats, risks, and vulnerabilities that can negatively impact those assets. And that's what having a security mindset is all about. A security mindset is the ability to evaluate risk and constantly seek out and identify the potential or actual breach of a system, application, or data. Earlier in the program, we discussed threats, risks, and vulnerabilities that are posed by social engineering attacks, such as phishing. These attacks are designed to compromise an organization's assets to help the threat actor or actors gain access to sensitive information. Using our security mindset can help prevent these types of attacks. It's important that we're constantly staying up to date with the kinds of attacks that are happening. To do this, it's good to develop a habit of seeking out information regarding the latest security trends or vulnerabilities. As you do this, new ideas for protecting company data may come to mind. Security is an everyday objective for every security team in the industry. So having a security mindset helps analysts defend against the constant pressure from attackers. That mindset can make you think every click of the mouse has the potential to lead to a security breach. That level of scrutiny as a security professional helps you prepare for the worst-case scenario, even if it doesn't happen. Entry-level analysts can help protect low level assets, such as an organization's guest Wi-Fi network, and high importance assets, such as intellectual property, trade secrets, PII, and even financial information. Your security mindset allows you to protect all levels of assets. However, if an incident does occur, that doesn't mean you respond to all incidents in the same way. So we'll discuss incident prioritization a little later in the course. Having a strong security mindset can help set you apart from other candidates as you prepare to enter"
3EgYr7jR4NI,4,"mindset can help set you apart from other candidates as you prepare to enter the security profession. It may even be a good idea to reference that foundation in future job interviews. We'll discuss interview preparation in detail later in the course. Coming up, we'll focus on incident detection in greater detail. Welcome back. In earlier courses, we discussed the impact that security incidents can have on the critical data and assets of an organization. If data and assets are compromised, it can lead to financial pains for an organization. It can even lead to regulatory fines and the loss of credibility with customers or other businesses in the same industry. This is why your role in protecting company data and assets is so valuable. Collaboration is an exciting part about working in security. There are so many individuals across an organization that are interested in various functions of security. No security professional can do this alone. Some team members are focused on protecting sensitive financial data. Others work on protecting usernames and passwords. Some are more focused on protecting third-party vendor security. And others may be concerned with protecting employees' PII. These stakeholders and others have an interest in the role the security team plays for keeping the organization and the people it serves safe from malicious attacks. It's important to recognize that the assets and data you protect affect multiple levels of your organization. One of the most important concerns for an organization is the protection of customer data. Customers trust that an organization they engage with will protect their data at all times. This means credit card numbers, Social Security numbers, emails, usernames, passwords, and so much more. It's important to keep this in mind when taking on a security role. Understanding the importance of the data you're protecting is a big part of having a"
3EgYr7jR4NI,5,"of the data you're protecting is a big part of having a strong security mindset. As a security professional, it's important to handle sensitive data with care while being mindful of the little details to ensure that private data is protected from breaches. When a security event results in a data breach, it is categorized as a security incident. However, if the event is resolved without resulting in a breach, it's not considered an incident. It's better to be safe when it comes to taking a job in the security profession. That means paying attention to details and raising your issues to your supervisor. For example, a seemingly small issue like an employee installing an app on their work device without getting permission from the help desk should be escalated to a supervisor. This is because some apps have vulnerabilities that can pose a threat to the security of the organization. An example of a bigger issue is noticing that a log may have malicious code executed in it. Malicious code can lead to operational downtime, severe financial consequences, or the loss of critical high-level assets. The point is that there are no issues that are too small or too big. If you're not sure of the potential impact of an incident, it's always best to be cautious and report events to the appropriate team members. Each day on the job as a security professional comes with a level of responsibility to help protect the organization and the people it serves. The decisions you make not only affect the company but also its customers and countless team members across the organization. Remember, what you do matters. You've had an opportunity to learn more about the important role an entry level analyst plays in protecting the data and assets of an organization. Let's quickly review what we covered. We started off by discussing the importance of having a security"
3EgYr7jR4NI,6,"what we covered. We started off by discussing the importance of having a security mindset, including how it supports incident detection. Then we examined the relationship between incidents and events and further explored the incident escalation process. We ended our discussion by exploring the sensitive nature of the data that you're protecting and the amount of people counting on you to play your part in protecting that data. Understanding how valuable you are as a member of the security team can help you put the work you do into perspective. Every role in security matters. Each individual contributes to making a company's operations flow smoothly. I hope you enjoyed our discussion as much as I did. Are you ready to continue your journey into the security world? Coming up, we'll discuss the importance of escalating security incidents. I'm excited that you could join me today. Previously, you learned about the importance of various asset types. You also learned about the relationship between incidents and events. Now we'll focus on escalating those incidents and events to the right people. Protecting the data and assets of an organization is the primary goal of a security team. The decisions you make everyday are important for helping the security team achieve that goal. Recognizing when and how to escalate security incidents is crucial. It helps ensure simple issues don't become larger problems for an organization. Escalation is a term you should familiarize yourself with. It's likely to resurface often as you continue your journey into the security profession. In the following videos, we'll discuss incident escalation from an entry-level analyst perspective. Then we'll explore various incident classification types and the impact security incidents can have on business operations. Finally, we'll share some general guidelines for escalating incidents. Coming up, we'll start by focusing on incident escalation and how it can be used to"
